{
  "id": "ASCE7-22-26.1-E1",
  "type": "formula",
  "source": {
    "standard": "ASCE 7-22",
    "chapter": 26,
    "section": "26.1",
    "page": 2
  },
  "title": "Open Building Wall Opening Requirement",
  "description": "Formula for determining if a wall meets the open building criteria",
  "data": {
    "expression": "A_o >= 0.8A_g",
    "parameters": {
      "A_o": {
        "unit": "ft\u00b2",
        "source": "total area of openings in the wall that receives positive external pressure"
      },
      "A_g": {
        "unit": "ft\u00b2",
        "source": "gross surface area of that wall in which A_o is identified"
      }
    },
    "samples": {}
  },
  "cross_references": [],
  "metadata": {
    "extracted_by": "auto",
    "qc_status": "passed",
    "qc_notes": null
  }
}
